{
  "schemaVersion": 1,
  "product": {
    "nameZh": "纤云叙",
    "nameEn": "XianYun AI Voice Input"
  },
  "channel": "beta",
  "version": "0.1.16",
  "publishedAt": "2026-08-14T01:25:47Z",
  "releasePageUrl": "https://github.com/gdhucoder/xianyun-releases/releases/tag/v0.1.16",
  "platforms": {
    "macos-arm64": {
      "status": "available",
      "displayName": "macOS Apple Silicon",
      "architecture": "arm64",
      "minimumOsVersion": "macOS 10.15",
      "downloadUrl": "https://github.com/gdhucoder/xianyun-releases/releases/download/v0.1.16/XianYunAIVoiceInput_0.1.16_aarch64.dmg",
      "fileName": "XianYunAIVoiceInput_0.1.16_aarch64.dmg",
      "sizeBytes": 22657214,
      "sha256": "a341e3b8242f74c37aaf802546143e5d992c9aaed1e17a4074088edf406e0513",
      "installGuideUrl": "/install/macos/",
      "signingStatus": "self-signed-not-notarized"
    },
    "windows-x64": {
      "status": "available",
      "displayName": "Windows x64",
      "architecture": "x64",
      "minimumOsVersion": "Windows 10/11 x64（新增功能待真机验证）",
      "downloadUrl": "https://github.com/gdhucoder/xianyun-releases/releases/download/v0.1.16/XianYunAIVoiceInput_0.1.16_x64-setup.exe",
      "fileName": "XianYunAIVoiceInput_0.1.16_x64-setup.exe",
      "sizeBytes": 12244588,
      "sha256": "3bd87450303aa8c144595ac7f9eeeeb998565411636eaeb24991fdb00f70f12f",
      "installGuideUrl": "/install/windows/",
      "signingStatus": "unsigned"
    }
  },
  "models": {
    "sensevoice-small": {
      "status": "available",
      "displayName": "SenseVoiceSmall q8",
      "version": "SenseVoiceSmall-GGUF@90c1c619-q8",
      "downloadUrl": "https://github.com/gdhucoder/xianyun-releases/releases/tag/model-sensevoice-small-q8-macos-arm64-v1",
      "sizeBytes": 254208320,
      "sha256": "4ae45c94422de949b387e2e0fb10d7e14e4c42c69db30c3444ecc7d4b844b7c5",
      "installMode": "in-app",
      "platformReleaseUrls": {
        "macos-arm64": "https://github.com/gdhucoder/xianyun-releases/releases/tag/model-sensevoice-small-q8-macos-arm64-v1",
        "windows-x64": "https://github.com/gdhucoder/xianyun-releases/releases/tag/model-sensevoice-small-q8-windows-x64-v1"
      }
    }
  }
}
